    1   0.000000  192.168.1.2 → 212.204.214.114 IRC 96 Request (ISON)
    2   0.125852 212.204.214.114 → 192.168.1.2  TCP 66 6667 → 2848 [ACK] Seq=1 Ack=31 Win=57890 Len=0 TSval=2196036564 TSecr=14215752
    3   0.137361 212.204.214.114 → 192.168.1.2  IRC 112 Response (303)
    4   0.137413  192.168.1.2 → 212.204.214.114 TCP 66 2848 → 6667 [ACK] Seq=31 Ack=47 Win=8011 Len=0 TSval=14215889 TSecr=2196036565
    5   0.235960  192.168.1.2 → 192.168.1.1  DNS 84 Standard query 0x311f PTR 2.1.168.192.in-addr.arpa
    6   0.236116  192.168.1.2 → 192.168.1.1  DNS 88 Standard query 0x3120 PTR 114.214.204.212.in-addr.arpa
    7   0.270252  192.168.1.1 → 192.168.1.2  DNS 84 Standard query response 0x311f PTR 2.1.168.192.in-addr.arpa
    8   0.294105  192.168.1.1 → 192.168.1.2  DNS 123 Standard query response 0x3120 PTR 114.214.204.212.in-addr.arpa PTR sterling.freenode.net
    9   0.985963  192.168.1.2 → 192.168.1.1  DNS 81 Standard query 0x3121 A sterling.freenode.net
   10   0.988328  192.168.1.1 → 192.168.1.2  DNS 97 Standard query response 0x3121 A sterling.freenode.net A 212.204.214.114
   11   1.735567  192.168.1.2 → 192.168.1.1  DNS 84 Standard query 0x3122 PTR 1.1.168.192.in-addr.arpa
   12   1.737982  192.168.1.1 → 192.168.1.2  DNS 110 Standard query response 0x3122 PTR 1.1.168.192.in-addr.arpa PTR voyager.home
   13   2.485441  192.168.1.2 → 192.168.1.1  DNS 72 Standard query 0x3123 A voyager.home
   14   2.487702  192.168.1.1 → 192.168.1.2  DNS 88 Standard query response 0x3123 A voyager.home A 192.168.1.1
   15   3.343603 71.10.179.129 → 192.168.1.2  TCP 93 14232 → 4026 [PSH, ACK] Seq=1 Ack=1 Win=63807 Len=27 TSval=1887947 TSecr=14211796
   16   3.343657  192.168.1.2 → 71.10.179.129 TCP 66 4026 → 14232 [ACK] Seq=1 Ack=28 Win=742 Len=0 TSval=14219096 TSecr=1887947
   17   3.542328  192.168.1.2 → 71.10.179.129 TCP 90 4026 → 14232 [PSH, ACK] Seq=1 Ack=28 Win=768 Len=24 TSval=14219295 TSecr=1887947
   18   3.563622 212.204.214.114 → 192.168.1.2  IRC 157 Response (PRIVMSG)
   19   3.563675  192.168.1.2 → 212.204.214.114 TCP 66 2848 → 6667 [ACK] Seq=31 Ack=138 Win=8011 Len=0 TSval=14219316 TSecr=2196036907
   20   3.835582 71.10.179.129 → 192.168.1.2  TCP 66 14232 → 4026 [ACK] Seq=28 Ack=25 Win=63783 Len=0 TSval=1887953 TSecr=14219295
   21   3.985200  192.168.1.2 → 192.168.1.1  DNS 86 Standard query 0x3124 PTR 129.179.10.71.in-addr.arpa
   22   4.246622  192.168.1.1 → 192.168.1.2  DNS 138 Standard query response 0x3124 PTR 129.179.10.71.in-addr.arpa PTR 71-10-179-129.dhcp.stls.mo.charter.com
   23   4.555073 172.200.160.242 → 192.168.1.2  TCP 108 11352 → 4984 [PSH, ACK] Seq=1 Ack=1 Win=65127 Len=42 TSval=1744627 TSecr=14208134
   24   4.555122  192.168.1.2 → 172.200.160.242 TCP 66 4984 → 11352 [ACK] Seq=1 Ack=43 Win=747 Len=0 TSval=14220308 TSecr=1744627
   25   4.735117  192.168.1.2 → 192.168.1.1  DNS 88 Standard query 0x3125 PTR 242.160.200.172.in-addr.arpa
   26   4.735183  192.168.1.2 → 192.168.1.1  DNS 98 Standard query 0x3126 A 71-10-179-129.dhcp.stls.mo.charter.com
   27   4.743793  192.168.1.1 → 192.168.1.2  DNS 114 Standard query response 0x3126 A 71-10-179-129.dhcp.stls.mo.charter.com A 71.10.179.129
   28   4.844321  192.168.1.1 → 192.168.1.2  DNS 122 Standard query response 0x3125 PTR 242.160.200.172.in-addr.arpa PTR ACC8A0F2.ipt.aol.com
   29   5.485025  192.168.1.2 → 192.168.1.1  DNS 80 Standard query 0x3127 A ACC8A0F2.ipt.aol.com
   30   5.487428  192.168.1.1 → 192.168.1.2  DNS 96 Standard query response 0x3127 A ACC8A0F2.ipt.aol.com A 172.200.160.242
   31   5.839974 212.204.214.114 → 192.168.1.2  IRC 136 Response (PRIVMSG)
   32   5.840024  192.168.1.2 → 212.204.214.114 TCP 66 2848 → 6667 [ACK] Seq=31 Ack=208 Win=8011 Len=0 TSval=14221593 TSecr=2196037135
   33   8.052271 212.204.214.114 → 192.168.1.2  IRC 143 Response (PRIVMSG)
   34   8.052316  192.168.1.2 → 212.204.214.114 TCP 66 2848 → 6667 [ACK] Seq=31 Ack=285 Win=8011 Len=0 TSval=14223805 TSecr=2196037356
   35   9.261266 71.10.179.129 → 192.168.1.2  TCP 111 14232 → 4026 [PSH, ACK] Seq=28 Ack=25 Win=63783 Len=45 TSval=1888007 TSecr=14219295
   36   9.261328  192.168.1.2 → 71.10.179.129 TCP 66 4026 → 14232 [ACK] Seq=25 Ack=73 Win=762 Len=0 TSval=14225014 TSecr=1888007
   37  10.650161 3Com_96:7b:da → Broadcast    AoE 32 Query Config Information Request
   38  12.894007 86.128.100.24 → 192.168.1.2  TCP 78 2029 → 135 [SYN] Seq=0 Win=53760 Len=0 MSS=1452 WS=8 TSval=0 TSecr=0 SACK_PERM=1
   39  12.894075  192.168.1.2 → 86.128.100.24 TCP 54 135 → 2029 [RST, ACK] Seq=1 Ack=1 Win=0 Len=0
   40  12.941784 172.200.160.242 → 192.168.1.2  TCP 93 11352 → 4984 [PSH, ACK] Seq=43 Ack=1 Win=65127 Len=27 TSval=1744712 TSecr=14220308
   41  12.941834  192.168.1.2 → 172.200.160.242 TCP 66 4984 → 11352 [ACK] Seq=1 Ack=70 Win=744 Len=0 TSval=14228696 TSecr=1744712
   42  12.983830  192.168.1.2 → 192.168.1.1  DNS 86 Standard query 0x3128 PTR 24.100.128.86.in-addr.arpa
   43  13.015618  192.168.1.1 → 192.168.1.2  DNS 147 Standard query response 0x3128 PTR 24.100.128.86.in-addr.arpa PTR host86-128-100-24.range86-128.btcentralplus.com
   44  13.140851  192.168.1.2 → 172.200.160.242 TCP 90 4984 → 11352 [PSH, ACK] Seq=1 Ack=70 Win=768 Len=24 TSval=14228895 TSecr=1744712
   45  13.409946 172.200.160.242 → 192.168.1.2  TCP 66 11352 → 4984 [ACK] Seq=70 Ack=25 Win=65103 Len=0 TSval=1744717 TSecr=14228895
   46  13.410436 68.95.198.126 → 192.168.1.2  TCP 73 1928 → 2996 [PSH, ACK] Seq=1 Ack=1 Win=65419 Len=7 TSval=71317 TSecr=14133959
   47  13.410471  192.168.1.2 → 68.95.198.126 TCP 66 2996 → 1928 [ACK] Seq=1 Ack=8 Win=1452 Len=0 TSval=14229164 TSecr=71317
   48  13.733730  192.168.1.2 → 192.168.1.1  DNS 107 Standard query 0x3129 A host86-128-100-24.range86-128.btcentralplus.com
   49  13.736371  192.168.1.1 → 192.168.1.2  DNS 123 Standard query response 0x3129 A host86-128-100-24.range86-128.btcentralplus.com A 86.128.100.24
   50  13.934761 86.128.187.110 → 192.168.1.2  TCP 62 4048 → 139 [SYN] Seq=0 Win=65535 Len=0 MSS=1452 SACK_PERM=1
   51  13.934833  192.168.1.2 → 86.128.187.110 TCP 54 139 → 4048 [RST, ACK] Seq=1 Ack=1 Win=0 Len=0
   52  14.308410 24.177.122.79 → 192.168.1.2  ASAP 91 Unknown ASAP type [Packet size limited during capture]
   53  14.308461  192.168.1.2 → 24.177.122.79 TCP 66 3863 → 8022 [ACK] Seq=1 Ack=26 Win=764 Len=0 TSval=14230062 TSecr=3339898
   54  14.507644  192.168.1.2 → 24.177.122.79 ASAP 91 Unknown ASAP type [Packet size limited during capture]
   55  14.800928 24.177.122.79 → 192.168.1.2  TCP 66 8022 → 3863 [ACK] Seq=26 Ack=26 Win=16296 Len=0 TSval=3339904 TSecr=14230262
   56  14.860289 212.204.214.114 → 192.168.1.2  IRC 132 Response (PRIVMSG)
   57  14.860338  192.168.1.2 → 212.204.214.114 TCP 66 2848 → 6667 [ACK] Seq=31 Ack=351 Win=8011 Len=0 TSval=14230614 TSecr=2196038037
   58  15.233520  192.168.1.2 → 192.168.1.1  DNS 86 Standard query 0x312a PTR 126.198.95.68.in-addr.arpa
   59  15.233581  192.168.1.2 → 192.168.1.1  DNS 87 Standard query 0x312b PTR 110.187.128.86.in-addr.arpa
   60  15.233608  192.168.1.2 → 192.168.1.1  DNS 86 Standard query 0x312c PTR 79.122.177.24.in-addr.arpa
   61  15.273294  192.168.1.1 → 192.168.1.2  DNS 149 Standard query response 0x312b PTR 110.187.128.86.in-addr.arpa PTR host86-128-187-110.range86-128.btcentralplus.com
   62  15.441443  192.168.1.1 → 192.168.1.2  DNS 143 Standard query response 0x312a PTR 126.198.95.68.in-addr.arpa PTR adsl-68-95-198-126.dsl.wlfrct.sbcglobal.net
   63  15.465692  192.168.1.1 → 192.168.1.2  DNS 138 Standard query response 0x312c PTR 79.122.177.24.in-addr.arpa PTR 24-177-122-79.dhcp.mdsn.wi.charter.com
   64  15.510644  192.168.1.2 → 212.204.214.114 IRC 82 Request (WHO)
   65  15.635477 212.204.214.114 → 192.168.1.2  TCP 66 6667 → 2848 [ACK] Seq=351 Ack=47 Win=57904 Len=0 TSval=2196038115 TSecr=14231265
   66  15.680903 212.204.214.114 → 192.168.1.2  IRC 1090 Response (352) (352) (352) (352) (352) (352) (352) (352)
   67  15.680936  192.168.1.2 → 212.204.214.114 TCP 66 2848 → 6667 [ACK] Seq=47 Ack=1375 Win=8011 Len=0 TSval=14231435 TSecr=2196038119
   68  15.719610 212.204.214.114 → 192.168.1.2  IRC 1152 Response (aul) (352) (352) (352) (352) (352) (352) (352) (352) (315)
   69  15.719647  192.168.1.2 → 212.204.214.114 TCP 66 2848 → 6667 [ACK] Seq=47 Ack=2461 Win=8011 Len=0 TSval=14231474 TSecr=2196038122
   70  15.990754  192.168.1.2 → 192.168.1.1  DNS 108 Standard query 0x312d A host86-128-187-110.range86-128.btcentralplus.com
   71  15.990820  192.168.1.2 → 192.168.1.1  DNS 103 Standard query 0x312e A adsl-68-95-198-126.dsl.wlfrct.sbcglobal.net
   72  15.990854  192.168.1.2 → 192.168.1.1  DNS 98 Standard query 0x312f A 24-177-122-79.dhcp.mdsn.wi.charter.com
   73  15.993707  192.168.1.1 → 192.168.1.2  DNS 124 Standard query response 0x312d A host86-128-187-110.range86-128.btcentralplus.com A 86.128.187.110
   74  15.996119  192.168.1.1 → 192.168.1.2  DNS 119 Standard query response 0x312e A adsl-68-95-198-126.dsl.wlfrct.sbcglobal.net A 68.95.198.126
   75  15.998392  192.168.1.1 → 192.168.1.2  DNS 114 Standard query response 0x312f A 24-177-122-79.dhcp.mdsn.wi.charter.com A 24.177.122.79
   76  16.497352 212.204.214.114 → 192.168.1.2  IRC 160 Response (PRIVMSG)
   77  16.497407  192.168.1.2 → 212.204.214.114 TCP 66 2848 → 6667 [ACK] Seq=47 Ack=2555 Win=8011 Len=0 TSval=14232252 TSecr=2196038201
   78  16.616793 172.200.160.242 → 192.168.1.2  TCP 99 11352 → 4984 [PSH, ACK] Seq=70 Ack=25 Win=65103 Len=33 TSval=1744748 TSecr=14228895
   79  16.616850  192.168.1.2 → 172.200.160.242 TCP 66 4984 → 11352 [ACK] Seq=25 Ack=103 Win=763 Len=0 TSval=14232371 TSecr=1744748
   80  16.881600 86.128.187.110 → 192.168.1.2  TCP 62 [TCP Retransmission] 4048 → 139 [SYN] Seq=0 Win=65535 Len=0 MSS=1452 SACK_PERM=1
   81  16.881655  192.168.1.2 → 86.128.187.110 TCP 54 139 → 4048 [RST, ACK] Seq=1 Ack=1 Win=0 Len=0
   82  20.240865  192.168.1.2 → 212.204.214.114 IRC 96 Request (ISON)
   83  20.354439 212.204.214.114 → 192.168.1.2  IRC 112 Response (303)
   84  20.354491  192.168.1.2 → 212.204.214.114 TCP 66 2848 → 6667 [ACK] Seq=77 Ack=2601 Win=8011 Len=0 TSval=14236109 TSecr=2196038586
   85  21.353539 71.10.179.129 → 192.168.1.2  TCP 112 14232 → 4026 [PSH, ACK] Seq=73 Ack=25 Win=63783 Len=46 TSval=1888127 TSecr=14225014
   86  21.353587  192.168.1.2 → 71.10.179.129 TCP 66 4026 → 14232 [ACK] Seq=25 Ack=119 Win=756 Len=0 TSval=14237109 TSecr=1888127
   87  28.326676  192.168.1.2 → 68.32.70.119 TCP 70 3563 → 1215 [PSH, ACK] Seq=1 Ack=1 Win=864 Len=4 TSval=14244083 TSecr=14268207
   88  28.455768 68.32.70.119 → 192.168.1.2  TCP 82 1215 → 3563 [PSH, ACK] Seq=1 Ack=5 Win=16324 Len=16 TSval=14269405 TSecr=14244083
   89  28.455831  192.168.1.2 → 68.32.70.119 TCP 70 3563 → 1215 [PSH, ACK] Seq=5 Ack=17 Win=864 Len=4 TSval=14244212 TSecr=14269405
   90  28.637656 172.200.160.242 → 192.168.1.2  TCP 108 11352 → 4984 [PSH, ACK] Seq=103 Ack=25 Win=65103 Len=42 TSval=1744869 TSecr=14232371
   91  28.637705  192.168.1.2 → 172.200.160.242 TCP 66 4984 → 11352 [ACK] Seq=25 Ack=145 Win=758 Len=0 TSval=14244394 TSecr=1744869
   92  28.736442  192.168.1.2 → 192.168.1.1  DNS 85 Standard query 0x3130 PTR 119.70.32.68.in-addr.arpa
   93  28.765268 68.32.70.119 → 192.168.1.2  TCP 70 1215 → 3563 [PSH, ACK] Seq=17 Ack=9 Win=16320 Len=4 TSval=14269407 TSecr=14244212
   94  28.804379  192.168.1.2 → 68.32.70.119 TCP 66 3563 → 1215 [ACK] Seq=9 Ack=21 Win=864 Len=0 TSval=14244561 TSecr=14269407
   95  28.843010  192.168.1.1 → 192.168.1.2  DNS 133 Standard query response 0x3130 PTR 119.70.32.68.in-addr.arpa PTR c-68-32-70-119.hsd1.ga.comcast.net
   96  29.489652  192.168.1.2 → 192.168.1.1  DNS 94 Standard query 0x3131 A c-68-32-70-119.hsd1.ga.comcast.net
   97  29.492249  192.168.1.1 → 192.168.1.2  DNS 110 Standard query response 0x3131 A c-68-32-70-119.hsd1.ga.comcast.net A 68.32.70.119
   98  29.774411  192.168.1.2 → 71.10.179.129 TCP 92 4026 → 14232 [PSH, ACK] Seq=25 Ack=119 Win=768 Len=26 TSval=14245531 TSecr=1888127
   99  29.774446  192.168.1.2 → 172.200.160.242 TCP 92 4984 → 11352 [PSH, ACK] Seq=25 Ack=145 Win=768 Len=26 TSval=14245531 TSecr=1744869
  100  29.774464  192.168.1.2 → 24.177.122.79 ASAP 92 Unknown ASAP type [Packet size limited during capture]
  101  29.971776 172.200.160.242 → 192.168.1.2  TCP 66 11352 → 4984 [ACK] Seq=145 Ack=51 Win=65077 Len=0 TSval=1744883 TSecr=14245531
  102  30.050840 24.177.122.79 → 192.168.1.2  TCP 66 8022 → 3863 [ACK] Seq=26 Ack=52 Win=16270 Len=0 TSval=3340057 TSecr=14245531
  103  30.076690 71.10.179.129 → 192.168.1.2  TCP 66 14232 → 4026 [ACK] Seq=119 Ack=51 Win=63757 Len=0 TSval=1888215 TSecr=14245531
  104  31.422311 212.204.214.114 → 192.168.1.2  IRC 186 Response (PRIVMSG)
  105  31.422367  192.168.1.2 → 212.204.214.114 TCP 66 2848 → 6667 [ACK] Seq=77 Ack=2721 Win=8011 Len=0 TSval=14247179 TSecr=2196039693
  106  32.642907 212.204.214.114 → 192.168.1.2  IRC 171 Response (PRIVMSG)
  107  32.642957  192.168.1.2 → 212.204.214.114 TCP 66 2848 → 6667 [ACK] Seq=77 Ack=2826 Win=8011 Len=0 TSval=14248400 TSecr=2196039815
  108  33.935899 71.10.179.129 → 192.168.1.2  TCP 107 14232 → 4026 [PSH, ACK] Seq=119 Ack=51 Win=63757 Len=41 TSval=1888253 TSecr=14245531
  109  33.935953  192.168.1.2 → 71.10.179.129 TCP 66 4026 → 14232 [ACK] Seq=51 Ack=160 Win=762 Len=0 TSval=14249693 TSecr=1888253
  110  35.396949 24.177.122.79 → 192.168.1.2  ASAP 92 Unknown ASAP type [Packet size limited during capture]
  111  35.397001  192.168.1.2 → 24.177.122.79 TCP 66 3863 → 8022 [ACK] Seq=52 Ack=52 Win=764 Len=0 TSval=14251154 TSecr=3340109
  112  37.774119 212.204.214.114 → 192.168.1.2  IRC 144 Response (PRIVMSG)
  113  37.774166  192.168.1.2 → 212.204.214.114 TCP 66 2848 → 6667 [ACK] Seq=77 Ack=2904 Win=8011 Len=0 TSval=14253532 TSecr=2196040328
  114  38.217999  192.168.1.2 → 68.95.198.126 TCP 67 2996 → 1928 [PSH, ACK] Seq=1 Ack=8 Win=1452 Len=1 TSval=14253976 TSecr=71317
  115  38.440981 68.95.198.126 → 192.168.1.2  TCP 67 1928 → 2996 [PSH, ACK] Seq=8 Ack=2 Win=65418 Len=1 TSval=71567 TSecr=14253976
  116  38.441086  192.168.1.2 → 68.95.198.126 TCP 66 2996 → 1928 [ACK] Seq=2 Ack=9 Win=1452 Len=0 TSval=14254199 TSecr=71567
  117  38.501122  192.168.1.2 → 212.204.214.114 IRC 78 Request (WHO)
  118  38.634436 212.204.214.114 → 192.168.1.2  TCP 66 6667 → 2848 [ACK] Seq=2904 Ack=89 Win=57908 Len=0 TSval=2196040415 TSecr=14254259
  119  38.683169 212.204.214.114 → 192.168.1.2  IRC 1090 Response (352) (352) (352) (352) (352) (352) (352) (352)
  120  38.683226  192.168.1.2 → 212.204.214.114 TCP 66 2848 → 6667 [ACK] Seq=89 Ack=3928 Win=8011 Len=0 TSval=14254441 TSecr=2196040419
  121  38.689423 212.204.214.114 → 192.168.1.2  IRC 1514 Response (de.net) (352) (352) (352) (352) (352) (352) (352) (352) (352) (352) (352) (352)
  122  38.689474  192.168.1.2 → 212.204.214.114 TCP 66 2848 → 6667 [ACK] Seq=89 Ack=5376 Win=8011 Len=0 TSval=14254447 TSecr=2196040419
  123  38.722365 212.204.214.114 → 192.168.1.2  IRC 1514 Response (on) (352) (352) (352) (352) (352) (352) (352) (352) (352) (352) (352)
  124  38.722417  192.168.1.2 → 212.204.214.114 TCP 66 2848 → 6667 [ACK] Seq=89 Ack=6824 Win=8011 Len=0 TSval=14254480 TSecr=2196040423
  125  38.728295 212.204.214.114 → 192.168.1.2  IRC 1514 Response (pussinboots) (352) (352) (352) (352) (352) (352) (352) (352) (352) (352) (352) (352)
  126  38.728344  192.168.1.2 → 212.204.214.114 TCP 66 2848 → 6667 [ACK] Seq=89 Ack=8272 Win=8011 Len=0 TSval=14254486 TSecr=2196040423
  127  38.734163 212.204.214.114 → 192.168.1.2  IRC 1514 Response (freenode.net) (352) (352) (352) (352) (352) (352) (352) (352) (352) (352) (352)
  128  38.734208  192.168.1.2 → 212.204.214.114 TCP 66 2848 → 6667 [ACK] Seq=89 Ack=9720 Win=8011 Len=0 TSval=14254492 TSecr=2196040423
  129  38.762244 212.204.214.114 → 192.168.1.2  IRC 1514 Response ('Realia') (352) (352) (352) (352) (352) (352) (352) (352) (352) (352) (352) (352)
  130  38.762291  192.168.1.2 → 212.204.214.114 TCP 66 2848 → 6667 [ACK] Seq=89 Ack=11168 Win=8011 Len=0 TSval=14254520 TSecr=2196040427
  131  38.768156 212.204.214.114 → 192.168.1.2  IRC 1514 Response (t) (352) (352) (352) (352) (352) (352) (352) (352) (352) (352) (352) (352)
  132  38.768198  192.168.1.2 → 212.204.214.114 TCP 66 2848 → 6667 [ACK] Seq=89 Ack=12616 Win=8011 Len=0 TSval=14254526 TSecr=2196040427
  133  38.773838 212.204.214.114 → 192.168.1.2  IRC 1514 Response (irc.freenode.net) (352) (352) (352) (352) (352) (352) (352) (352) (352) (352) (352)
  134  38.773887  192.168.1.2 → 212.204.214.114 TCP 66 2848 → 6667 [ACK] Seq=89 Ack=14064 Win=8011 Len=0 TSval=14254532 TSecr=2196040428
  135  38.779754 212.204.214.114 → 192.168.1.2  IRC 1514 Response (g.freenode.net) (352) (352) (352) (352) (352) (352) (352) (352) (352) (352) (352) (352)
  136  38.779793  192.168.1.2 → 212.204.214.114 TCP 66 2848 → 6667 [ACK] Seq=89 Ack=15512 Win=8011 Len=0 TSval=14254537 TSecr=2196040428
  137  38.801683 212.204.214.114 → 192.168.1.2  IRC 1514 Response (-183.winn.adsl.virgin.net) (352) (352) (352) (352) (352) (352) (352) (352) (352) (352) (352) (352) (352)
  138  38.801733  192.168.1.2 → 212.204.214.114 TCP 66 2848 → 6667 [ACK] Seq=89 Ack=16960 Win=8011 Len=0 TSval=14254559 TSecr=2196040431
  139  38.807825 212.204.214.114 → 192.168.1.2  IRC 1514 Response (amarok) (352) (352) (352) (352) (352) (352) (352) (352) (352) (352) (352) (352)
  140  38.807858  192.168.1.2 → 212.204.214.114 TCP 66 2848 → 6667 [ACK] Seq=89 Ack=18408 Win=8011 Len=0 TSval=14254566 TSecr=2196040431
  141  38.813745 212.204.214.114 → 192.168.1.2  IRC 1514 Response (.freenode.net) (352) (352) (352) (352) (352) (352) (352) (352) (352) (352) (352)
  142  38.813776  192.168.1.2 → 212.204.214.114 TCP 66 2848 → 6667 [ACK] Seq=89 Ack=19856 Win=8011 Len=0 TSval=14254571 TSecr=2196040432
  143  38.819661 212.204.214.114 → 192.168.1.2  IRC 1514 Response (terling.freenode.net) (352) (352) (352) (352) (352) (352) (352) (352) (352) (352) (352) (352)
  144  38.819687  192.168.1.2 → 212.204.214.114 TCP 66 2848 → 6667 [ACK] Seq=89 Ack=21304 Win=8011 Len=0 TSval=14254577 TSecr=2196040432
  145  38.825827 212.204.214.114 → 192.168.1.2  IRC 1514 Response (illefiz.de) (352) (352) (352) (352) (352) (352) (352) (352) (352) (352) (352) (352)
  146  38.825876  192.168.1.2 → 212.204.214.114 TCP 66 2848 → 6667 [ACK] Seq=89 Ack=22752 Win=8011 Len=0 TSval=14254584 TSecr=2196040432
  147  38.841821 212.204.214.114 → 192.168.1.2  IRC 1514 Response (r) (352) (352) (352) (352) (352) (352) (352) (352) (352) (352) (352) (352) (352)
  148  38.841853  192.168.1.2 → 212.204.214.114 TCP 66 2848 → 6667 [ACK] Seq=89 Ack=24200 Win=8011 Len=0 TSval=14254600 TSecr=2196040435
  149  38.878684 212.204.214.114 → 192.168.1.2  IRC 881 Response (net) (352) (352) (352) (352) (352) (315)
  150  38.878731  192.168.1.2 → 212.204.214.114 TCP 66 2848 → 6667 [ACK] Seq=89 Ack=25015 Win=8011 Len=0 TSval=14254636 TSecr=2196040439
  151  40.371818  192.168.1.2 → 212.204.214.114 IRC 96 Request (ISON)
  152  40.456680 212.204.214.114 → 192.168.1.2  IRC 112 Response (303)
  153  40.456731  192.168.1.2 → 212.204.214.114 TCP 66 2848 → 6667 [ACK] Seq=119 Ack=25061 Win=8011 Len=0 TSval=14256215 TSecr=2196040597
  154  41.063549 172.200.160.242 → 192.168.1.2  TCP 109 11352 → 4984 [PSH, ACK] Seq=145 Ack=51 Win=65077 Len=43 TSval=1744992 TSecr=14245531
  155  41.063603  192.168.1.2 → 172.200.160.242 TCP 66 4984 → 11352 [ACK] Seq=51 Ack=188 Win=762 Len=0 TSval=14256822 TSecr=1744992
  156  43.445162 212.204.214.114 → 192.168.1.2  IRC 155 Response (PRIVMSG)
  157  43.445212  192.168.1.2 → 212.204.214.114 TCP 66 2848 → 6667 [ACK] Seq=119 Ack=25150 Win=8011 Len=0 TSval=14259204 TSecr=2196040776
  158  43.445541 212.204.214.114 → 192.168.1.2  IRC 155 [TCP Spurious Retransmission] Response (PRIVMSG)
  159  43.445564  192.168.1.2 → 212.204.214.114 TCP 66 [TCP Dup ACK 157#1] 2848 → 6667 [ACK] Seq=119 Ack=25150 Win=8011 Len=0 TSval=14259204 TSecr=2196040896
  160  46.062197 71.10.179.129 → 192.168.1.2  TCP 102 14232 → 4026 [PSH, ACK] Seq=160 Ack=51 Win=63757 Len=36 TSval=1888375 TSecr=14249693
  161  46.062246  192.168.1.2 → 71.10.179.129 TCP 66 4026 → 14232 [ACK] Seq=51 Ack=196 Win=758 Len=0 TSval=14261821 TSecr=1888375
  162  48.386328 71.10.179.129 → 192.168.1.2  TCP 93 14232 → 4026 [PSH, ACK] Seq=196 Ack=51 Win=63757 Len=27 TSval=1888398 TSecr=14261821
  163  48.386383  192.168.1.2 → 71.10.179.129 TCP 66 4026 → 14232 [ACK] Seq=51 Ack=223 Win=755 Len=0 TSval=14264145 TSecr=1888398
  164  48.585467  192.168.1.2 → 71.10.179.129 TCP 90 4026 → 14232 [PSH, ACK] Seq=51 Ack=223 Win=768 Len=24 TSval=14264345 TSecr=1888398
  165  48.909402 71.10.179.129 → 192.168.1.2  TCP 66 14232 → 4026 [ACK] Seq=223 Ack=75 Win=63733 Len=0 TSval=1888404 TSecr=14264345
  166  53.854605 172.200.160.242 → 192.168.1.2  TCP 109 11352 → 4984 [PSH, ACK] Seq=188 Ack=51 Win=65077 Len=43 TSval=1745120 TSecr=14256822
  167  53.854653  192.168.1.2 → 172.200.160.242 TCP 66 4984 → 11352 [ACK] Seq=51 Ack=231 Win=757 Len=0 TSval=14269615 TSecr=1745120
  168  57.999281 172.200.160.242 → 192.168.1.2  TCP 93 11352 → 4984 [PSH, ACK] Seq=231 Ack=51 Win=65077 Len=27 TSval=1745162 TSecr=14269615
  169  57.999330  192.168.1.2 → 172.200.160.242 TCP 66 4984 → 11352 [ACK] Seq=51 Ack=258 Win=753 Len=0 TSval=14273760 TSecr=1745162
  170  58.065534 71.10.179.129 → 192.168.1.2  TCP 106 14232 → 4026 [PSH, ACK] Seq=223 Ack=75 Win=63733 Len=40 TSval=1888495 TSecr=14264345
  171  58.065585  192.168.1.2 → 71.10.179.129 TCP 66 4026 → 14232 [ACK] Seq=75 Ack=263 Win=763 Len=0 TSval=14273826 TSecr=1888495
  172  58.198005  192.168.1.2 → 172.200.160.242 TCP 91 4984 → 11352 [PSH, ACK] Seq=51 Ack=258 Win=768 Len=25 TSval=14273959 TSecr=1745162
  173  58.342665 172.200.160.242 → 192.168.1.2  TCP 66 11352 → 4984 [ACK] Seq=258 Ack=76 Win=65052 Len=0 TSval=1745167 TSecr=14273959
  174  58.850187 AskeyCom_19:27:15 → 3Com_96:7b:da ARP 60 Who has 192.168.1.2? Tell 192.168.1.1
  175  58.850216 3Com_96:7b:da → AskeyCom_19:27:15 ARP 42 192.168.1.2 is at 00:04:76:96:7b:da
  176  59.980506  192.168.1.2 → 86.197.95.238 UDP 60 35990 → 44019 Len=18
  177  60.296652  192.168.1.2 → 192.168.1.1  DNS 86 Standard query 0x3132 PTR 238.95.197.86.in-addr.arpa
  178  60.349634  192.168.1.1 → 192.168.1.2  DNS 146 Standard query response 0x3132 PTR 238.95.197.86.in-addr.arpa PTR AMarseille-253-1-68-238.w86-197.abo.wanadoo.fr
  179  60.502729  192.168.1.2 → 212.204.214.114 IRC 96 Request (ISON)
  180  60.545156 212.204.214.114 → 192.168.1.2  IRC 112 Response (303)
  181  60.545207  192.168.1.2 → 212.204.214.114 TCP 66 2848 → 6667 [ACK] Seq=149 Ack=25196 Win=8011 Len=0 TSval=14276306 TSecr=2196042606
  182  61.046539  192.168.1.2 → 192.168.1.1  DNS 106 Standard query 0x3133 A AMarseille-253-1-68-238.w86-197.abo.wanadoo.fr
  183  61.049174  192.168.1.1 → 192.168.1.2  DNS 122 Standard query response 0x3133 A AMarseille-253-1-68-238.w86-197.abo.wanadoo.fr A 86.197.95.238
  184  61.058676  192.168.1.2 → 86.31.70.81  UDP 60 35990 → 43870 Len=18
  185  61.058779  192.168.1.2 → 86.220.100.25 UDP 60 35990 → 1378 Len=18
  186  61.058832  192.168.1.2 → 86.130.63.111 UDP 60 35990 → 12505 Len=18
  187  61.058898  192.168.1.2 → 80.216.195.140 UDP 60 35990 → 1277 Len=18
  188  61.508252 24.177.122.79 → 192.168.1.2  ASAP 91 Unknown ASAP type [Packet size limited during capture]
  189  61.508298  192.168.1.2 → 24.177.122.79 TCP 66 3863 → 8022 [ACK] Seq=52 Ack=77 Win=761 Len=0 TSval=14277269 TSecr=3340370
  190  61.707579  192.168.1.2 → 24.177.122.79 ASAP 91 Unknown ASAP type [Packet size limited during capture]
  191  61.796427  192.168.1.2 → 192.168.1.1  DNS 84 Standard query 0x3134 PTR 81.70.31.86.in-addr.arpa
  192  61.796492  192.168.1.2 → 192.168.1.1  DNS 86 Standard query 0x3135 PTR 25.100.220.86.in-addr.arpa
  193  61.796519  192.168.1.2 → 192.168.1.1  DNS 86 Standard query 0x3136 PTR 111.63.130.86.in-addr.arpa
  194  61.796545  192.168.1.2 → 192.168.1.1  DNS 87 Standard query 0x3137 PTR 140.195.216.80.in-addr.arpa
  195  61.833926  192.168.1.1 → 192.168.1.2  DNS 137 Standard query response 0x3134 PTR 81.70.31.86.in-addr.arpa PTR client-86-31-70-81.midd.adsl.virgin.net
  196  61.851872  192.168.1.1 → 192.168.1.2  DNS 147 Standard query response 0x3136 PTR 111.63.130.86.in-addr.arpa PTR host86-130-63-111.range86-130.btcentralplus.com
  197  61.857341  192.168.1.1 → 192.168.1.2  DNS 143 Standard query response 0x3135 PTR 25.100.220.86.in-addr.arpa PTR AOrleans-257-1-93-25.w86-220.abo.wanadoo.fr
  198  61.869551  192.168.1.1 → 192.168.1.2  DNS 133 Standard query response 0x3137 PTR 140.195.216.80.in-addr.arpa PTR c80-216-195-140.cm-upc.chello.se
  199  61.958161 24.177.122.79 → 192.168.1.2  TCP 66 8022 → 3863 [ACK] Seq=77 Ack=77 Win=16245 Len=0 TSval=3340376 TSecr=14277469
  200  62.546310  192.168.1.2 → 192.168.1.1  DNS 99 Standard query 0x3138 A client-86-31-70-81.midd.adsl.virgin.net
  201  62.546352  192.168.1.2 → 192.168.1.1  DNS 107 Standard query 0x3139 A host86-130-63-111.range86-130.btcentralplus.com
  202  62.546377  192.168.1.2 → 192.168.1.1  DNS 103 Standard query 0x313a A AOrleans-257-1-93-25.w86-220.abo.wanadoo.fr
  203  62.546401  192.168.1.2 → 192.168.1.1  DNS 92 Standard query 0x313b A c80-216-195-140.cm-upc.chello.se
  204  62.549479  192.168.1.1 → 192.168.1.2  DNS 115 Standard query response 0x3138 A client-86-31-70-81.midd.adsl.virgin.net A 86.31.70.81
  205  62.551917  192.168.1.1 → 192.168.1.2  DNS 123 Standard query response 0x3139 A host86-130-63-111.range86-130.btcentralplus.com A 86.130.63.111
  206  62.554242  192.168.1.1 → 192.168.1.2  DNS 119 Standard query response 0x313a A AOrleans-257-1-93-25.w86-220.abo.wanadoo.fr A 86.220.100.25
  207  62.556683  192.168.1.1 → 192.168.1.2  DNS 108 Standard query response 0x313b A c80-216-195-140.cm-upc.chello.se A 80.216.195.140
  208  63.283730 212.204.214.114 → 192.168.1.2  IRC 137 Response (PRIVMSG)
  209  63.283784  192.168.1.2 → 212.204.214.114 TCP 66 2848 → 6667 [ACK] Seq=149 Ack=25267 Win=8011 Len=0 TSval=14279045 TSecr=2196042879
  210  64.421739 24.177.122.79 → 192.168.1.2  ASAP 91 Unknown ASAP type [Packet size limited during capture]
  211  64.421795  192.168.1.2 → 24.177.122.79 TCP 66 3863 → 8022 [ACK] Seq=77 Ack=102 Win=764 Len=0 TSval=14280183 TSecr=3340400
  212  64.574303 65.190.6.124 → 192.168.1.2  TCP 231 47452 → 2967 [PSH, ACK] Seq=1 Ack=1 Win=64399 Len=165 TSval=3302578 TSecr=13945552
  213  64.574359  192.168.1.2 → 65.190.6.124 TCP 66 2967 → 47452 [ACK] Seq=1 Ack=166 Win=998 Len=0 TSval=14280336 TSecr=3302578
  214  66.122955  192.168.1.2 → 165.124.253.241 UDP 60 35990 → 15294 Len=18
  215  66.249381 165.124.253.241 → 192.168.1.2  UDP 60 15294 → 35990 Len=11
  216  66.249507  192.168.1.2 → 165.124.253.241 UDP 65 35990 → 15294 Len=23
  217  66.357031  192.168.1.2 → 192.168.1.1  DNS 85 Standard query 0x313c PTR 124.6.190.65.in-addr.arpa
  218  66.357080  192.168.1.2 → 192.168.1.1  DNS 88 Standard query 0x313d PTR 241.253.124.165.in-addr.arpa
  219  66.370892 165.124.253.241 → 192.168.1.2  UDP 93 15294 → 35990 Len=51
  220  66.371270  192.168.1.2 → 81.236.228.111 UDP 60 35990 → 42764 Len=18
  221  66.431975 81.236.228.111 → 192.168.1.2  UDP 93 42764 → 35990 Len=51
  222  66.432373  192.168.1.2 → 86.142.117.124 UDP 60 35990 → 36474 Len=18
  223  66.468533  192.168.1.1 → 192.168.1.2  DNS 135 Standard query response 0x313c PTR 124.6.190.65.in-addr.arpa PTR cpe-065-190-006-124.triad.res.rr.com
  224  66.712287  192.168.1.1 → 192.168.1.2  DNS 140 Standard query response 0x313d PTR 241.253.124.165.in-addr.arpa PTR engmanlab10.pathology.northwestern.edu
  225  67.092614  192.168.1.2 → 192.168.1.1  DNS 96 Standard query 0x313e A cpe-065-190-006-124.triad.res.rr.com
  226  67.092654  192.168.1.2 → 192.168.1.1  DNS 98 Standard query 0x313f A engmanlab10.pathology.northwestern.edu
  227  67.095968  192.168.1.1 → 192.168.1.2  DNS 112 Standard query response 0x313e A cpe-065-190-006-124.triad.res.rr.com A 65.190.6.124
  228  67.098311  192.168.1.1 → 192.168.1.2  DNS 114 Standard query response 0x313f A engmanlab10.pathology.northwestern.edu A 165.124.253.241
  229  67.177962  192.168.1.2 → 86.142.178.222 UDP 60 35990 → 12881 Len=18
  230  67.178065  192.168.1.2 → 86.128.163.125 UDP 60 35990 → 25906 Len=18
  231  67.178116  192.168.1.2 → 86.134.79.66 UDP 60 35990 → 3444 Len=18
  232  67.178159  192.168.1.2 → 86.136.192.70 UDP 60 35990 → 16329 Len=18
  233  67.211756 86.128.163.125 → 192.168.1.2  ICMP 70 Destination unreachable (Port unreachable)
  234  67.221831 86.134.79.66 → 192.168.1.2  ICMP 70 Destination unreachable (Port unreachable)
  235  67.277765 172.200.160.242 → 192.168.1.2  TCP 112 11352 → 4984 [PSH, ACK] Seq=258 Ack=76 Win=65052 Len=46 TSval=1745255 TSecr=14273959
  236  67.277815  192.168.1.2 → 172.200.160.242 TCP 66 4984 → 11352 [ACK] Seq=76 Ack=304 Win=762 Len=0 TSval=14283040 TSecr=1745255
  237  70.138116 71.10.179.129 → 192.168.1.2  TCP 114 14232 → 4026 [PSH, ACK] Seq=263 Ack=75 Win=63733 Len=48 TSval=1888615 TSecr=14273826
  238  70.138164  192.168.1.2 → 71.10.179.129 TCP 66 4026 → 14232 [ACK] Seq=75 Ack=311 Win=757 Len=0 TSval=14285901 TSecr=1888615
  239  70.641037 3Com_96:7b:da → Broadcast    AoE 32 Query Config Information Request
  240  70.846034  192.168.1.2 → 192.168.1.1  DNS 87 Standard query 0x3140 PTR 111.228.236.81.in-addr.arpa
  241  70.846083  192.168.1.2 → 192.168.1.1  DNS 87 Standard query 0x3141 PTR 124.117.142.86.in-addr.arpa
  242  70.846110  192.168.1.2 → 192.168.1.1  DNS 87 Standard query 0x3142 PTR 222.178.142.86.in-addr.arpa
  243  70.846138  192.168.1.2 → 192.168.1.1  DNS 87 Standard query 0x3143 PTR 125.163.128.86.in-addr.arpa
  244  70.846165  192.168.1.2 → 192.168.1.1  DNS 85 Standard query 0x3144 PTR 66.79.134.86.in-addr.arpa
  245  70.846191  192.168.1.2 → 192.168.1.1  DNS 86 Standard query 0x3145 PTR 70.192.136.86.in-addr.arpa
  246  70.893064  192.168.1.1 → 192.168.1.2  DNS 149 Standard query response 0x3141 PTR 124.117.142.86.in-addr.arpa PTR host86-142-117-124.range86-142.btcentralplus.com
  247  70.898426  192.168.1.1 → 192.168.1.2  DNS 149 Standard query response 0x3142 PTR 222.178.142.86.in-addr.arpa PTR host86-142-178-222.range86-142.btcentralplus.com
  248  70.906310  192.168.1.1 → 192.168.1.2  DNS 149 Standard query response 0x3143 PTR 125.163.128.86.in-addr.arpa PTR host86-128-163-125.range86-128.btcentralplus.com
  249  70.910193  192.168.1.1 → 192.168.1.2  DNS 135 Standard query response 0x3140 PTR 111.228.236.81.in-addr.arpa PTR 81-236-228-111-no37.tbcn.telia.com
  250  70.914329  192.168.1.1 → 192.168.1.2  DNS 145 Standard query response 0x3144 PTR 66.79.134.86.in-addr.arpa PTR host86-134-79-66.range86-134.btcentralplus.com
  251  70.918736  192.168.1.1 → 192.168.1.2  DNS 147 Standard query response 0x3145 PTR 70.192.136.86.in-addr.arpa PTR host86-136-192-70.range86-136.btcentralplus.com
  252  71.595939  192.168.1.2 → 192.168.1.1  DNS 108 Standard query 0x3146 A host86-142-117-124.range86-142.btcentralplus.com
  253  71.595982  192.168.1.2 → 192.168.1.1  DNS 108 Standard query 0x3147 A host86-142-178-222.range86-142.btcentralplus.com
  254  71.596007  192.168.1.2 → 192.168.1.1  DNS 108 Standard query 0x3148 A host86-128-163-125.range86-128.btcentralplus.com
  255  71.596031  192.168.1.2 → 192.168.1.1  DNS 94 Standard query 0x3149 A 81-236-228-111-no37.tbcn.telia.com
  256  71.596056  192.168.1.2 → 192.168.1.1  DNS 106 Standard query 0x314a A host86-134-79-66.range86-134.btcentralplus.com
  257  71.596080  192.168.1.2 → 192.168.1.1  DNS 107 Standard query 0x314b A host86-136-192-70.range86-136.btcentralplus.com
  258  71.599631  192.168.1.1 → 192.168.1.2  DNS 124 Standard query response 0x3146 A host86-142-117-124.range86-142.btcentralplus.com A 86.142.117.124
  259  71.602195  192.168.1.1 → 192.168.1.2  DNS 124 Standard query response 0x3147 A host86-142-178-222.range86-142.btcentralplus.com A 86.142.178.222
  260  71.604560  192.168.1.1 → 192.168.1.2  DNS 124 Standard query response 0x3148 A host86-128-163-125.range86-128.btcentralplus.com A 86.128.163.125
  261  71.607073  192.168.1.1 → 192.168.1.2  DNS 110 Standard query response 0x3149 A 81-236-228-111-no37.tbcn.telia.com A 81.236.228.111
  262  71.609505  192.168.1.1 → 192.168.1.2  DNS 122 Standard query response 0x314a A host86-134-79-66.range86-134.btcentralplus.com A 86.134.79.66
  263  71.612115  192.168.1.1 → 192.168.1.2  DNS 123 Standard query response 0x314b A host86-136-192-70.range86-136.btcentralplus.com A 86.136.192.70
  264  72.197961  192.168.1.2 → 80.186.57.176 UDP 60 35990 → 8788 Len=18
  265  72.274479 80.186.57.176 → 192.168.1.2  UDP 93 8788 → 35990 Len=51
  266  72.274824  192.168.1.2 → 68.206.150.243 UDP 60 35990 → 57322 Len=18
  267  72.423135 68.206.150.243 → 192.168.1.2  UDP 60 57322 → 35990 Len=18
  268  72.423544  192.168.1.2 → 68.206.150.243 TCP 74 1312 → 57322 [SYN] Seq=0 Win=5840 Len=0 MSS=1460 SACK_PERM=1 TSval=14288186 TSecr=0 WS=8
  269  72.481883  192.168.1.2 → 82.128.194.105 UDP 60 35990 → 60142 Len=18
  270  72.560107 212.50.132.237 → 192.168.1.2  ICMP 70 Time-to-live exceeded (Time to live exceeded in transit)
  271  72.570621 68.206.150.243 → 192.168.1.2  TCP 78 57322 → 1312 [SYN, ACK] Seq=0 Ack=1 Win=65535 Len=0 MSS=1460 WS=1 TSval=0 TSecr=0 SACK_PERM=1
  272  72.570680  192.168.1.2 → 68.206.150.243 TCP 66 1312 → 57322 [ACK] Seq=1 Ack=1 Win=5840 Len=0 TSval=14288333 TSecr=0
  273  72.571013  192.168.1.2 → 68.206.150.243 TCP 80 1312 → 57322 [PSH, ACK] Seq=1 Ack=1 Win=5840 Len=14 TSval=14288334 TSecr=0
  274  72.718991 68.206.150.243 → 192.168.1.2  TCP 139 57322 → 1312 [PSH, ACK] Seq=1 Ack=15 Win=65521 Len=73 TSval=2294351 TSecr=14288334
  275  72.719049  192.168.1.2 → 68.206.150.243 TCP 66 1312 → 57322 [ACK] Seq=15 Ack=74 Win=5840 Len=0 TSval=14288482 TSecr=2294351
  276  72.719358  192.168.1.2 → 68.206.150.243 TCP 91 1312 → 57322 [PSH, ACK] Seq=15 Ack=74 Win=5840 Len=25 TSval=14288482 TSecr=2294351
  277  72.869554 68.206.150.243 → 192.168.1.2  TCP 653 57322 → 1312 [PSH, ACK] Seq=74 Ack=40 Win=65496 Len=587 TSval=2294353 TSecr=14288482
  278  72.872568  192.168.1.2 → 68.206.150.243 TCP 82 1312 → 57322 [PSH, ACK] Seq=40 Ack=661 Win=7016 Len=16 TSval=14288635 TSecr=2294353
  279  73.019589 68.206.150.243 → 192.168.1.2  TCP 340 57322 → 1312 [PSH, ACK] Seq=661 Ack=56 Win=65480 Len=274 TSval=2294354 TSecr=14288635
  280  73.059659  192.168.1.2 → 68.206.150.243 TCP 66 1312 → 57322 [ACK] Seq=56 Ack=935 Win=8192 Len=0 TSval=14288823 TSecr=2294354
  281  73.130966  192.168.1.2 → 192.168.1.1  DNS 86 Standard query 0x314c PTR 176.57.186.80.in-addr.arpa
  282  73.131039  192.168.1.2 → 192.168.1.1  DNS 87 Standard query 0x314d PTR 243.150.206.68.in-addr.arpa
  283  73.218650  192.168.1.1 → 192.168.1.2  DNS 135 Standard query response 0x314c PTR 176.57.186.80.in-addr.arpa PTR a80-186-57-176.elisa-laajakaista.fi
  284  73.226490  192.168.1.2 → 68.206.150.243 TCP 77 1312 → 57322 [PSH, ACK] Seq=56 Ack=935 Win=8192 Len=11 TSval=14288989 TSecr=2294354
  285  73.236155  192.168.1.2 → 204.152.205.205 UDP 78 60577 → 33435 Len=36
  286  73.248439  192.168.1.1 → 192.168.1.2  DNS 134 Standard query response 0x314d PTR 243.150.206.68.in-addr.arpa PTR cpe-68-206-150-243.hot.res.rr.com
  287  73.252664 217.47.73.141 → 192.168.1.2  ICMP 70 Time-to-live exceeded (Time to live exceeded in transit)
  288  73.376132 68.206.150.243 → 192.168.1.2  TCP 725 57322 → 1312 [PSH, ACK] Seq=935 Ack=67 Win=65469 Len=659 TSval=2294358 TSecr=14288989
  289  73.376187  192.168.1.2 → 68.206.150.243 TCP 111 1312 → 57322 [PSH, ACK] Seq=67 Ack=1594 Win=9512 Len=45 TSval=14289139 TSecr=2294358
  290  73.527127 68.206.150.243 → 192.168.1.2  TCP 70 57322 → 1312 [PSH, ACK] Seq=1594 Ack=112 Win=65424 Len=4 TSval=2294359 TSecr=14289139
  291  73.566583  192.168.1.2 → 68.206.150.243 TCP 66 1312 → 57322 [ACK] Seq=112 Ack=1598 Win=9512 Len=0 TSval=14289330 TSecr=2294359
  292  73.756705  192.168.1.2 → 195.215.8.141 TCP 74 1325 → 33033 [SYN] Seq=0 Win=5840 Len=0 MSS=1460 SACK_PERM=1 TSval=14289520 TSecr=0 WS=8
  293  73.829254 195.215.8.141 → 192.168.1.2  TCP 74 33033 → 1325 [SYN, ACK] Seq=0 Ack=1 Win=5792 Len=0 MSS=1460 SACK_PERM=1 TSval=1049909348 TSecr=14289520 WS=1
  294  73.829316  192.168.1.2 → 195.215.8.141 TCP 66 1325 → 33033 [ACK] Seq=1 Ack=1 Win=5840 Len=0 TSval=14289592 TSecr=1049909348
  295  73.840522  192.168.1.2 → 83.147.171.206 UDP 64 35990 → 6293 Len=22
  296  73.840590  192.168.1.2 → 172.207.190.217 UDP 64 35990 → 51361 Len=22
  297  73.840700  192.168.1.2 → 195.215.8.141 TCP 71 1325 → 33033 [PSH, ACK] Seq=1 Ack=1 Win=5840 Len=5 TSval=14289604 TSecr=1049909348
  298  73.867190  192.168.1.2 → 192.168.1.1  DNS 87 Standard query 0x314e PTR 105.194.128.82.in-addr.arpa
  299  73.867252  192.168.1.2 → 192.168.1.1  DNS 95 Standard query 0x314f A a80-186-57-176.elisa-laajakaista.fi
  300  73.867276  192.168.1.2 → 192.168.1.1  DNS 93 Standard query 0x3150 A cpe-68-206-150-243.hot.res.rr.com
  301  73.867300  192.168.1.2 → 192.168.1.1  DNS 87 Standard query 0x3151 PTR 237.132.50.212.in-addr.arpa
  302  73.867326  192.168.1.2 → 192.168.1.1  DNS 88 Standard query 0x3152 PTR 205.205.152.204.in-addr.arpa
  303  73.867354  192.168.1.2 → 192.168.1.1  DNS 86 Standard query 0x3153 PTR 141.73.47.217.in-addr.arpa
  304  73.877654  192.168.1.1 → 192.168.1.2  DNS 111 Standard query response 0x314f A a80-186-57-176.elisa-laajakaista.fi A 80.186.57.176
  305  73.880404  192.168.1.1 → 192.168.1.2  DNS 109 Standard query response 0x3150 A cpe-68-206-150-243.hot.res.rr.com A 68.206.150.243
  306  73.914410 83.147.171.206 → 192.168.1.2  UDP 700 6293 → 35990 Len=658
  307  73.917277  192.168.1.2 → 190.44.165.86 UDP 60 35990 → 57549 Len=18
  308  73.917335  192.168.1.2 → 83.130.238.168 UDP 60 35990 → 26744 Len=18
  309  73.917381  192.168.1.2 → 83.5.146.219 UDP 60 35990 → 1749 Len=18
  310  73.917450  192.168.1.2 → 82.253.163.244 UDP 60 35990 → 38930 Len=18
  311  73.919800 195.215.8.141 → 192.168.1.2  TCP 66 33033 → 1325 [ACK] Seq=1 Ack=6 Win=5792 Len=0 TSval=1049909357 TSecr=14289604
  312  73.933764  192.168.1.1 → 192.168.1.2  DNS 132 Standard query response 0x3153 PTR 141.73.47.217.in-addr.arpa PTR esr2.sheffield3.broadband.bt.net
  313  73.953845 172.207.190.217 → 192.168.1.2  UDP 711 51361 → 35990 Len=669
  314  73.958003 195.215.8.141 → 192.168.1.2  TCP 71 33033 → 1325 [PSH, ACK] Seq=1 Ack=6 Win=5792 Len=5 TSval=1049909361 TSecr=14289604
  315  73.958052  192.168.1.2 → 195.215.8.141 TCP 66 1325 → 33033 [ACK] Seq=6 Ack=6 Win=5840 Len=0 TSval=14289721 TSecr=1049909361
  316  73.959322  192.168.1.2 → 195.215.8.141 TCP 517 1325 → 33033 [PSH, ACK] Seq=6 Ack=6 Win=5840 Len=451 TSval=14289722 TSecr=1049909361
  317  73.965886  192.168.1.1 → 192.168.1.2  DNS 137 Standard query response 0x314e PTR 105.194.128.82.in-addr.arpa PTR Torik16-TR1-82-128-194-105.suomi.net
  318  73.972681  192.168.1.1 → 192.168.1.2  DNS 119 Standard query response 0x3151 PTR 237.132.50.212.in-addr.arpa PTR Torik16R1.opoy.net
  319  73.974354  192.168.1.2 → 202.139.177.147 UDP 78 60582 → 33435 Len=36
  320  73.979354  192.168.1.2 → 202.232.205.123 UDP 78 60583 → 33435 Len=36
  321  73.981045  192.168.1.2 → 130.244.145.31 UDP 78 60579 → 33435 Len=36
  322  73.981167  192.168.1.2 → 204.152.205.205 UDP 78 60577 → 33436 Len=36
  323  73.993520 217.47.73.141 → 192.168.1.2  ICMP 70 Time-to-live exceeded (Time to live exceeded in transit)
  324  73.994007  192.168.1.2 → 202.139.177.147 UDP 78 60582 → 33436 Len=36
  325  73.996685 217.47.73.141 → 192.168.1.2  ICMP 70 Time-to-live exceeded (Time to live exceeded in transit)
  326  73.996810  192.168.1.2 → 202.232.205.123 UDP 78 60583 → 33436 Len=36
  327  73.999166 217.47.73.141 → 192.168.1.2  ICMP 70 Time-to-live exceeded (Time to live exceeded in transit)
  328  73.999266  192.168.1.2 → 130.244.145.31 UDP 78 60579 → 33436 Len=36
  329  74.002112 217.47.73.30 → 192.168.1.2  ICMP 70 Time-to-live exceeded (Time to live exceeded in transit)
  330  74.002163  192.168.1.2 → 204.152.205.205 UDP 78 60577 → 33437 Len=36
  331  74.009547 217.47.73.30 → 192.168.1.2  ICMP 70 Time-to-live exceeded (Time to live exceeded in transit)
